{
  "$schema": "http://json-schema.org/draft-07/schema#",
  "title": "PSModuleMaintenance Configuration",
  "description": "Configuration schema for PSModuleMaintenance script",
  "type": "object",
  "properties": {
    "$schema": {
      "type": "string",
      "description": "JSON Schema reference"
    },
    "_comment": {
      "type": "string",
      "description": "Optional comment field"
    },
    "ExcludedModules": {
      "type": "array",
      "description": "List of module names to exclude from updates and pruning",
      "items": {
        "type": "string"
      },
      "default": [],
      "examples": [
        ["Az.Accounts", "Microsoft.Graph.Authentication"]
      ]
    },
    "PinnedModules": {
      "type": "object",
      "description": "Modules held at a specific version. The pinned version is installed if missing, and pruning keeps it instead of the newest version. A module listed in ExcludedModules is skipped entirely and its pin is ignored.",
      "additionalProperties": {
        "type": "string",
        "description": "Exact version to hold, optionally with a prerelease label (e.g. 2.19.0 or 2.0.0-beta1)",
        "pattern": "^\\d+(\\.\\d+){0,3}(-[A-Za-z0-9.]+)?$"
      },
      "default": {},
      "examples": [
        { "Az.Accounts": "2.19.0", "Pester": "5.5.0" }
      ]
    },
    "LogRetentionDays": {
      "type": "integer",
      "description": "Number of days to retain log files before automatic cleanup",
      "minimum": 1,
      "maximum": 365,
      "default": 180
    },
    "TrustPSGallery": {
      "type": "boolean",
      "description": "Whether to trust PSGallery repository during updates",
      "default": true
    },
    "NotificationMode": {
      "type": "string",
      "description": "When to show Windows toast notifications: Always, OnFailure, or Never",
      "enum": ["Always", "OnFailure", "Never"],
      "default": "Always"
    },
    "ModuleUpdateTimeoutSeconds": {
      "type": "integer",
      "description": "Maximum seconds to wait for a single module update before timing out and moving to the next module. Prevents one slow module (e.g. Microsoft.Graph) from consuming all scheduled task time.",
      "minimum": 60,
      "maximum": 3600,
      "default": 600
    },
    "Healthchecks": {
      "type": "object",
      "description": "Healthchecks.io dead-man's-switch monitoring. The ping URL itself is a bearer secret and is NOT stored here — keep it in the SecretManagement vault, e.g. Set-Secret -Name PSModuleMaintenance-Healthchecks -Secret 'https://hc-ping.com/<uuid>' -Vault SecretStore",
      "properties": {
        "Enabled": {
          "type": "boolean",
          "description": "Whether to send start/success/fail pings. Pings are always suppressed during a -WhatIf run so a dry run cannot reset the dead-man timer.",
          "default": false
        },
        "SecretName": {
          "type": "string",
          "description": "Name of the secret holding the full ping URL",
          "default": "PSModuleMaintenance-Healthchecks"
        },
        "SecretVault": {
          "type": "string",
          "description": "SecretManagement vault to read the ping URL from. Named explicitly rather than relying on the default-vault flag.",
          "default": "SecretStore"
        },
        "TimeoutSeconds": {
          "type": "integer",
          "description": "HTTP timeout per ping attempt. Each ping is retried twice before giving up.",
          "minimum": 1,
          "maximum": 120,
          "default": 10
        }
      },
      "additionalProperties": false
    }
  },
  "additionalProperties": false
}
