{
  "$schema": "./config.schema.json",
  "_comment": "Configuration for PSModuleMaintenance",
  
  "ExcludedModules": [

  ],

  "PinnedModules": {

  },

  "LogRetentionDays": 180,
  
  "TrustPSGallery": true,

  "NotificationMode": "Always",

  "ModuleUpdateTimeoutSeconds": 600,

  "Healthchecks": {
    "Enabled": true,
    "SecretName": "PSModuleMaintenance-Healthchecks",
    "SecretVault": "SecretStore",
    "TimeoutSeconds": 10
  }
}
